{
  "handoff_version": "2.0",
  "project_id": "proyecto-902-qa",
  "from_agent": "explorador",
  "to_agent": "cartografo",
  "transition": "0->1",
  "required_by_destination": ["1.1", "1.2"],
  "outputs": [
    {
      "skill_id": "1.1",
      "output_ref": "output.md#problema",
      "type": "document"
    },
    {
      "skill_id": "1.2",
      "output_ref": "output.md#poblacion",
      "type": "document"
    }
  ],
  "context_summary": "Consultorios independientes con recepción manual pierden turnos e ingresos por no-shows y coordinación por WhatsApp. Fase 0 validada para QA técnico con fixture simulado, sin INPUT_REQUEST pendiente.",
  "flags": ["QA_FIXTURE_VALIDATED", "NO_INPUT_REQUEST"],
  "created_at": "2026-06-26T22:40:00Z"
}
