{
  "handoff_version": "2.0",
  "project_id": "proyecto-901-qa",
  "from_agent": "explorador",
  "to_agent": "cartografo",
  "transition": "0->1",
  "required_by_destination": ["1.1", "1.2"],
  "outputs": [
    {
      "skill_id": "1.1",
      "output_ref": "output.md#problema",
      "type": "document"
    },
    {
      "skill_id": "1.2",
      "output_ref": "output.md#poblacion",
      "type": "document"
    }
  ],
  "context_summary": "Consultorios pequeños LATAM (1–3 profesionales) muestran dolor operativo por agendamiento manual y no-shows según research secundario. Segmento perfilado como recepción manual/WhatsApp. Hair-on-fire y disposición a pagar INCIERTO-NO-VALIDADO; INPUT_REQUEST ir-001 bloquea avance a Fase 1.",
  "flags": ["INCIERTO_NO_VALIDADO", "INPUT_REQUEST_PENDING:ir-001"],
  "created_at": "2026-06-26T18:30:00Z"
}
