{
  "handoff_version": "2.0",
  "project_id": "[project_id]",
  "from_agent": "analista-negocio",
  "to_agent": "arquitecto-ux",
  "transition": "2->3",
  "required_by_destination": ["1.1", "1.2", "4.1", "4.scope"],
  "outputs": [
    {
      "skill_id": "1.1",
      "output_ref": "../fase-0/output.md#problema",
      "type": "document"
    },
    {
      "skill_id": "1.2",
      "output_ref": "../fase-0/output.md#poblacion",
      "type": "document"
    },
    {
      "skill_id": "4.1",
      "output_ref": "output.md#modelo-negocio",
      "type": "document"
    },
    {
      "skill_id": "4.scope",
      "output_ref": "output.md#scope-producto",
      "type": "document"
    }
  ],
  "context_summary": "[Resumen de 2-3 lineas: problema/poblacion, modelo elegido, GTM, scope MVP y estado del Gate 0-2.]",
  "flags": ["[GATE_0_2_PENDING / GATE_0_2_APPROVED / ITERAR / KILL si aplica]"],
  "created_at": "[ISO8601]"
}
