{
  "handoff_version": "2.0",
  "project_id": "proyecto-903-qa",
  "from_agent": "analista-negocio",
  "to_agent": "arquitecto-ux",
  "transition": "2->3",
  "required_by_destination": ["1.1", "1.2", "4.1", "4.scope"],
  "outputs": [
    {
      "skill_id": "1.1",
      "output_ref": "../fase-0/output.md#problema",
      "type": "document"
    },
    {
      "skill_id": "1.2",
      "output_ref": "../fase-0/output.md#poblacion",
      "type": "document"
    },
    {
      "skill_id": "4.1",
      "output_ref": "output.md#modelo-negocio",
      "type": "document"
    },
    {
      "skill_id": "4.scope",
      "output_ref": "output.md#scope-producto",
      "type": "document"
    }
  ],
  "context_summary": "Problema: consultorios pequeños pierden turnos por agenda manual. Modelo: SaaS vertical liviano. Scope UX: onboarding, agenda semanal, turnos de hoy, detalle de turno y recordatorios.",
  "flags": ["GATE_0_2_APPROVED", "QA_FIXTURE"],
  "created_at": "2026-06-26T23:15:00Z"
}
