{
  "handoff_version": "2.0",
  "project_id": "proyecto-999-fixture",
  "from_agent": "explorador",
  "to_agent": "cartografo",
  "transition": "0->1",
  "required_by_destination": ["1.1", "1.2"],
  "outputs": [
    {
      "skill_id": "1.1",
      "output_ref": "fase-0/output.md#problema",
      "type": "document"
    },
    {
      "skill_id": "1.2",
      "output_ref": "fase-0/output.md#poblacion",
      "type": "document"
    }
  ],
  "context_summary": "Fixture que referencia #poblacion sin declararla en markdown.",
  "flags": [],
  "created_at": "2026-06-26T00:00:00Z"
}
