{
  "handoff_version": "2.0",
  "project_id": "proyecto-903-qa",
  "from_agent": "cartografo",
  "to_agent": "analista-negocio",
  "transition": "1->2",
  "required_by_destination": ["2.1", "2.2"],
  "outputs": [
    {
      "skill_id": "2.1",
      "output_ref": "output.md#mapa-competitivo",
      "type": "document"
    },
    {
      "skill_id": "2.2",
      "output_ref": "output.md#research-soluciones",
      "type": "document"
    }
  ],
  "context_summary": "El mercado tiene agendas SaaS y sustitutos manuales. La oportunidad UX es una agenda liviana centrada en turnos de hoy, confirmaciones y reprogramación simple.",
  "flags": ["QA_FIXTURE"],
  "created_at": "2026-06-26T23:12:00Z"
}
